{"schema":"geometry.step_topology.resolve_hit.result.a0","session":{"session_handle":"gts_1111111111111111111111111111111111111111111111111111111111111111","generation":7},"instance_index":100000,"primitive_index":999999,"triangle_index":9999999,"occurrence_handle":"gtt_2222222222222222222222222222222222222222222222222222222222222222","body_handle":"gtt_3333333333333333333333333333333333333333333333333333333333333333","face_handle":"gtt_4444444444444444444444444444444444444444444444444444444444444444"}
